{
    "schema":  "aios.openai_cli_readiness.v1",
    "mode":  "DRY_RUN",
    "local_fixture_only":  true,
    "openai_cli_detected":  false,
    "openai_api_key_env_detected":  false,
    "api_key_value_printed":  false,
    "forbidden_secret_files_present":  [

                                       ],
    "live_openai_api_call":  false,
    "admin_api_used":  false,
    "service_account_created":  false,
    "env_file_created":  false,
    "network_required":  false,
    "package_install_required":  false,
    "repo_mutation_allowed":  false,
    "human_approval_required":  true,
    "fail_closed":  true,
    "profitability_priority":  "TRUSTED_PROVEN_PROFITABILITY",
    "stop_point":  "Stop after local readiness report. Do not call OpenAI."
}
